### ISSUE TITLE
shipyard-controller failed to create new projects within an isolated namespace

### ISSUE THREAD

**Issue by checkelmann** [keptn/keptn#3747]
**Environment**

* Client OS (e.g., Linux, macOS, Windows): Ubuntu 20
* Keptn Version (`keptn version`): 0.8.1
* Kubernetes Cloud Provider (e.g., GKE, AKS): K3S
* Kubernetes version (`kubectl version`): 
```
Client Version: version.Info{Major:"1", Minor:"20", GitVersion:"v1.20.5", GitCommit:"6b1d87acf3c8253c123756b9e61dac642678305f", GitTreeState:"clean", BuildDate:"2021-03-18T01:10:43Z", GoVersion:"go1.15.8", Compiler:"gc", Platform:"linux/amd64"}
Server Version: version.Info{Major:"1", Minor:"20", GitVersion:"v1.20.5+k3s1", GitCommit:"355fff3017b06cde44dbd879408a3a6826fa7125", GitTreeState:"clean", BuildDate:"2021-03-31T06:21:52Z", GoVersion:"go1.15.10", Compiler:"gc", Platform:"linux/amd64"}
```

**Affected Component**

* [ ] Docs
* [X] CLI
* [ ] Kubernetes Integration
* [ ] Openshift Integration
* [ ] Helm
* [ ] Istio
* [ ] Bridge
* [ ] Approval
* [ ] Datastore
* [X] REST API
* [ ] eventbroker / distributor
* [ ] jmeter
* [X] Shipyard Controller

**Describe the bug**
When locking down the communication within the keptn namespace using a Network Policy, the Shipyard Controller could not create a new Project.

I've applied the following policy

- Allow traffic within the same namespace
- Allow Ingress from the NGINX Ingress Controller
- Allow Egress to kube-dns for name resolution
- Allow Egress outside of the cluster for port 80 and 443 to communicate with the dynatrace API or other external services

```
apiVersion: networking.k8s.io/v1
kind: NetworkPolicy
metadata:
  name: keptn
spec:
  podSelector: {}
  policyTypes:
    - Ingress
    - Egress
  ingress:
    - from:
        - podSelector: {}
    - from:
        - namespaceSelector: {}
          podSelector:
            matchLabels:
              app.kubernetes.io/name: ingress-nginx
  egress:
    - to:
        - namespaceSelector: {}
          podSelector:
            matchLabels:
              k8s-app: kube-dns
      ports:
        - port: 53
          protocol: UDP
    - to:
        - podSelector: {}
    - to:
        - ipBlock:
            cidr: 0.0.0.0/0
      ports:
        - port: 443
        - port: 80
```

After applying the policy the create project cli command is failing
```
root@keptn-dt:~/keptn-dt# keptn -v create project simpleservice10 --shipyard=./shipyard_simple.yaml
WARNING: Creating a project without Git upstream repository is not recommended.
You can configure a Git upstream repository using:

keptn update project PROJECTNAME --git-user=GIT_USER --git-token=GIT_TOKEN --git-remote-url=GIT_REMOTE_URL

Starting to create project
Connecting to server https://keptn-02.kdns.me/api
Error: Create project was unsuccessful.
Received unexpected response: 500 500 Internal Server Error
```

The Shipyard Controller is logging this error:
```
shipyard-controller-5d97dc94b5-j6tmm shipyard-controller 2021/04/09 06:24:39 [Recovery] 2021/04/09 - 06:24:39 panic recovered:
shipyard-controller-5d97dc94b5-j6tmm shipyard-controller interface conversion: error is *url.Error, not *errors.StatusError
```

Full namespace logs for the command:
```
api-gateway-nginx-5c566878fb-p99q8 api-gateway-nginx 10.42.0.48 - - [09/Apr/2021:06:24:37 +0000] "HEAD /api HTTP/1.1" 301 0 "-" "Go-http-client/1.1"
api-gateway-nginx-5c566878fb-p99q8 api-gateway-nginx 10.42.0.48 - - [09/Apr/2021:06:24:37 +0000] "HEAD /api/swagger-ui/ HTTP/1.1" 200 0 "https://keptn-02.kdns.me/api" "Go-http-client/1.1"
api-service-6f99fbb7c6-jnpwx api-service {"timestamp":"2021-04-09T06:24:37.067098429Z","logLevel":"INFO","message":"API received a GET metadata event"}
api-service-6f99fbb7c6-jnpwx api-service {"timestamp":"2021-04-09T06:24:38.09432787Z","logLevel":"ERROR","message":"Error getting deployment info: Get https://10.43.0.1:443/apis/apps/v1/namespaces/keptn-02/                                                          deployments/bridge: dial tcp 10.43.0.1:443: connect: connection refused"}
api-gateway-nginx-5c566878fb-p99q8 api-gateway-nginx 10.42.0.48 - - [09/Apr/2021:06:24:38 +0000] "GET /api/v1/metadata HTTP/1.1" 200 117 "-" "Go-http-client/1.1"
api-gateway-nginx-5c566878fb-p99q8 api-gateway-nginx 10.42.0.48 - - [09/Apr/2021:06:24:38 +0000] "HEAD /api HTTP/1.1" 301 0 "-" "Go-http-client/1.1"
api-gateway-nginx-5c566878fb-p99q8 api-gateway-nginx 10.42.0.48 - - [09/Apr/2021:06:24:38 +0000] "HEAD /api/swagger-ui/ HTTP/1.1" 200 0 "https://keptn-02.kdns.me/api" "Go-http-client/1.1"
mongodb-datastore-56846884c9-xbrxg distributor Received a message for topic [sh.keptn.event.project.create.started]
mongodb-datastore-56846884c9-xbrxg mongodb-datastore {"timestamp":"2021-04-09T06:24:38.109390014Z","logLevel":"DEBUG","message":"save event to data store"}
mongodb-datastore-56846884c9-xbrxg statistics-service-7fc796f8cb-cvspdmongodb-datastore  {"timestamp":"2021-04-09T06:24:38.109700628Z","logLevel":"DEBUG","message":"Storing event to collection simpleservice                                                          10"}
statistics-service mongodb-datastore-56846884c9-xbrxg[GIN] 2021/04/09 - 06:24:38 | 200 |      65.305µs |       127.0.0.1 | POST     "/v1/event"
 mongodb-datastore {"timestamp":"2021-04-09T06:24:38.109775398Z","logLevel":"DEBUG","message":"ensuring index for simpleservice10 exists"}
shipyard-controller-5d97dc94b5-j6tmm statistics-service-7fc796f8cb-cvspddistributor  Received CloudEvent with ID 21878908-6f1c-4286-b364-c99e9ccf6ae2. Forwarding to Keptn API.
distributor Received a message for topic [sh.keptn.event.project.create.started]
shipyard-controller-5d97dc94b5-j6tmm statistics-service-7fc796f8cb-cvspddistributor  No external API endpoint defined. Forwarding directly to NATS server
distributor sent: 21878908-6f1c-4286-b364-c99e9ccf6ae2
shipyard-controller-5d97dc94b5-j6tmm distributor sent: 21878908-6f1c-4286-b364-c99e9ccf6ae2, accepted: trueReceived a message for topic [sh.keptn.event.project.create.started]
shipyard-controller-5d97dc94b5-j6tmmshipyard-controller-5d97dc94b5-j6tmm  distributorshipyard-controller  sent: 21878908-6f1c-4286-b364-c99e9ccf6ae2
{"timestamp":"2021-04-09T06:24:38.108066754Z","logLevel":"INFO","message":"Received .started event: sh.keptn.event.project.create.started"}
mongodb-69dd888866-vflvs mongodb 2021-04-09T06:24:38.109+0000 I STORAGE  [conn74] createCollection: keptn.simpleservice10 with generated UUID: 185a200e-feaf-4a62-9bea-fe151f2e2d6d
shipyard-controller-5d97dc94b5-j6tmm shipyard-controller {"timestamp":"2021-04-09T06:24:38.108088214Z","logLevel":"ERROR","message":"Could not determine eventScope of event: event does not contain a stage"}
mongodb-69dd888866-vflvs mongodb 2021-04-09T06:24:38.118+0000 I INDEX    [conn74] build index on: keptn.simpleservice10 properties: { v: 2, key: { data.service: 1 }, name: "data.service_1", ns: "keptn.simpl                                                          eservice10" }
mongodb-69dd888866-vflvs mongodb 2021-04-09T06:24:38.118+0000 I INDEX    [conn74]        building index using bulk method; build may temporarily use up to 500 megabytes of RAM
mongodb-69dd888866-vflvs mongodb 2021-04-09T06:24:38.119+0000 I INDEX    [conn74] build index done.  scanned 0 total records. 0 secs
mongodb-69dd888866-vflvs mongodb 2021-04-09T06:24:38.121+0000 I INDEX    [conn74] build index on: keptn.simpleservice10 properties: { v: 2, key: { shkeptncontext: 1 }, name: "shkeptncontext_1", ns: "keptn.s                                                          impleservice10" }
mongodb-datastore-56846884c9-xbrxg mongodb-datastore data.service_1
mongodb-datastore-56846884c9-xbrxg mongodb-datastore {"timestamp":"2021-04-09T06:24:38.11926617Z","logLevel":"DEBUG","message":"created index for simpleservice10"}
mongodb-datastore-56846884c9-xbrxg mongodb-datastore {"timestamp":"2021-04-09T06:24:38.119290958Z","logLevel":"DEBUG","message":"ensuring index for simpleservice10 exists"}
mongodb-datastore-56846884c9-xbrxg mongodb-datastore shkeptncontext_1
mongodb-datastore-56846884c9-xbrxg mongodb-datastore {"timestamp":"2021-04-09T06:24:38.122664513Z","logLevel":"DEBUG","message":"created index for simpleservice10"}
mongodb-datastore-56846884c9-xbrxg mongodb-datastore {"timestamp":"2021-04-09T06:24:38.122686517Z","logLevel":"DEBUG","message":"ensuring index for simpleservice10 exists"}
mongodb-datastore-56846884c9-xbrxg mongodb-datastore type_1
mongodb-datastore-56846884c9-xbrxg mongodb-datastore {"timestamp":"2021-04-09T06:24:38.126247787Z","logLevel":"DEBUG","message":"created index for simpleservice10"}
mongodb-datastore-56846884c9-xbrxg mongodb-datastore {"timestamp":"2021-04-09T06:24:38.127214182Z","logLevel":"DEBUG","message":"insertedID: ObjectID(\"606ff326ef0cb2b98b1ab637\")"}
mongodb-datastore-56846884c9-xbrxg mongodb-datastore {"timestamp":"2021-04-09T06:24:38.127233952Z","logLevel":"DEBUG","message":"Storing mapping 933130b2-9832-4fc7-a705-82c8c298668a-\u003esimpleservice10"}
mongodb-datastore-56846884c9-xbrxg mongodb-datastore {"timestamp":"2021-04-09T06:24:38.127465335Z","logLevel":"DEBUG","message":"ensuring index for simpleservice10-rootEvents exists"}
mongodb-69dd888866-vflvs mongodb 2021-04-09T06:24:38.121+0000 I INDEX    [conn74]        building index using bulk method; build may temporarily use up to 500 megabytes of RAM
mongodb-datastore-56846884c9-xbrxg mongodb-datastore data.service_1
mongodb-datastore-56846884c9-xbrxg mongodb-datastore {"timestamp":"2021-04-09T06:24:38.137770936Z","logLevel":"DEBUG","message":"created index for simpleservice10-rootEvents"}
mongodb-datastore-56846884c9-xbrxg mongodb-datastore {"timestamp":"2021-04-09T06:24:38.137794243Z","logLevel":"DEBUG","message":"ensuring index for simpleservice10-rootEvents exists"}
mongodb-datastore-56846884c9-xbrxg mongodb-datastore time_1
mongodb-datastore-56846884c9-xbrxg mongodb-datastore {"timestamp":"2021-04-09T06:24:38.141443252Z","logLevel":"DEBUG","message":"created index for simpleservice10-rootEvents"}
mongodb-datastore-56846884c9-xbrxg mongodb-datastore {"timestamp":"2021-04-09T06:24:38.142613857Z","logLevel":"DEBUG","message":"Stored root event for KeptnContext: 933130b2-9832-4fc7-a705-82c8c298668a"}
mongodb-datastore-56846884c9-xbrxg mongodb-datastore {"timestamp":"2021-04-09T06:24:38.142631522Z","logLevel":"ERROR","message":"Root event for KeptnContext 933130b2-9832-4fc7-a705-82c8c298668a already exis                                                          ts in collection"}
mongodb-datastore-56846884c9-xbrxg mongodb-datastore {"timestamp":"2021-04-09T06:24:38.14263686Z","logLevel":"DEBUG","message":"inserted mapping 933130b2-9832-4fc7-a705-82c8c298668a-\u003esimpleservice10"}
mongodb-datastore-56846884c9-xbrxg distributor sent: 21878908-6f1c-4286-b364-c99e9ccf6ae2
mongodb-69dd888866-vflvs mongodb 2021-04-09T06:24:38.122+0000 I INDEX    [conn74] build index done.  scanned 0 total records. 0 secs
shipyard-controller-5d97dc94b5-j6tmm shipyard-controller [GIN] 2021/04/09 - 06:24:38 | 500 |     108.954µs |       127.0.0.1 | POST     "/v1/event"
mongodb-69dd888866-vflvs mongodb 2021-04-09T06:24:38.125+0000 I INDEX    [conn74] build index on: keptn.simpleservice10 properties: { v: 2, key: { type: 1 }, name: "type_1", ns: "keptn.simpleservice10" }
mongodb-69dd888866-vflvs mongodb 2021-04-09T06:24:38.125+0000 I INDEX    [conn74]        building index using bulk method; build may temporarily use up to 500 megabytes of RAM
mongodb-69dd888866-vflvs mongodb 2021-04-09T06:24:38.126+0000 I INDEX    [conn74] build index done.  scanned 0 total records. 0 secs
mongodb-69dd888866-vflvs mongodb 2021-04-09T06:24:38.127+0000 I STORAGE  [conn74] createCollection: keptn.simpleservice10-rootEvents with generated UUID: e18f1e2b-875e-4696-917c-8dc6b0726074
mongodb-69dd888866-vflvs mongodb 2021-04-09T06:24:38.136+0000 I INDEX    [conn74] build index on: keptn.simpleservice10-rootEvents properties: { v: 2, key: { data.service: 1 }, name: "data.service_1", ns: "                                                          keptn.simpleservice10-rootEvents" }
mongodb-69dd888866-vflvs mongodb 2021-04-09T06:24:38.136+0000 I INDEX    [conn74]        building index using bulk method; build may temporarily use up to 500 megabytes of RAM
mongodb-69dd888866-vflvs mongodb 2021-04-09T06:24:38.137+0000 I INDEX    [conn74] build index done.  scanned 0 total records. 0 secs
mongodb-69dd888866-vflvs mongodb 2021-04-09T06:24:38.140+0000 I INDEX    [conn74] build index on: keptn.simpleservice10-rootEvents properties: { v: 2, key: { time: 1 }, name: "time_1", ns: "keptn.simpleserv                                                          ice10-rootEvents" }
mongodb-69dd888866-vflvs mongodb 2021-04-09T06:24:38.140+0000 I INDEX    [conn74]        building index using bulk method; build may temporarily use up to 500 megabytes of RAM
mongodb-69dd888866-vflvs mongodb 2021-04-09T06:24:38.141+0000 I INDEX    [conn74] build index done.  scanned 0 total records. 0 secs
shipyard-controller-5d97dc94b5-j6tmm shipyard-controller
shipyard-controller-5d97dc94b5-j6tmm shipyard-controller
shipyard-controller-5d97dc94b5-j6tmm shipyard-controller 2021/04/09 06:24:39 [Recovery] 2021/04/09 - 06:24:39 panic recovered:
shipyard-controller-5d97dc94b5-j6tmm shipyard-controller interface conversion: error is *url.Error, not *errors.StatusError
shipyard-controller-5d97dc94b5-j6tmm shipyard-controller /usr/local/go/src/runtime/iface.go:255 (0x40be23)
shipyard-controller-5d97dc94b5-j6tmm shipyard-controller /usr/local/go/src/runtime/iface.go:265 (0x40bd63)
shipyard-controller-5d97dc94b5-j6tmm shipyard-controller /go/src/github.com/keptn/keptn/shipyard-controller/common/secretstore.go:70 (0x144dd81)
shipyard-controller-5d97dc94b5-j6tmm shipyard-controller /go/src/github.com/keptn/keptn/shipyard-controller/handler/projectmanager.go:385 (0x16bbe1a)
shipyard-controller-5d97dc94b5-j6tmm shipyard-controller /go/src/github.com/keptn/keptn/shipyard-controller/handler/projectmanager.go:90 (0x16b8e3d)
shipyard-controller-5d97dc94b5-j6tmm shipyard-controller /go/src/github.com/keptn/keptn/shipyard-controller/handler/projecthandler.go:154 (0x16b7348)
shipyard-controller-5d97dc94b5-j6tmm shipyard-controller /go/pkg/mod/github.com/gin-gonic/gin@v1.6.3/context.go:161 (0x98cdba)
shipyard-controller-5d97dc94b5-j6tmm shipyard-controller /go/pkg/mod/github.com/gin-gonic/gin@v1.6.3/recovery.go:83 (0x9a0be3)
shipyard-controller-5d97dc94b5-j6tmm shipyard-controller /go/pkg/mod/github.com/gin-gonic/gin@v1.6.3/context.go:161 (0x98cdba)
shipyard-controller-5d97dc94b5-j6tmm shipyard-controller /go/pkg/mod/github.com/gin-gonic/gin@v1.6.3/logger.go:241 (0x99fd10)
shipyard-controller-5d97dc94b5-j6tmm shipyard-controller /go/pkg/mod/github.com/gin-gonic/gin@v1.6.3/context.go:161 (0x98cdba)
shipyard-controller-5d97dc94b5-j6tmm shipyard-controller /go/pkg/mod/github.com/gin-gonic/gin@v1.6.3/gin.go:409 (0x99702c)
shipyard-controller-5d97dc94b5-j6tmm shipyard-controller /go/pkg/mod/github.com/gin-gonic/gin@v1.6.3/gin.go:367 (0x99672d)
shipyard-controller-5d97dc94b5-j6tmm shipyard-controller /usr/local/go/src/net/http/server.go:2802 (0x6e9ab3)
shipyard-controller-5d97dc94b5-j6tmm shipyard-controller /usr/local/go/src/net/http/server.go:1890 (0x6e5354)
shipyard-controller-5d97dc94b5-j6tmm shipyard-controller /usr/local/go/src/runtime/asm_amd64.s:1357 (0x45d980)
shipyard-controller-5d97dc94b5-j6tmm shipyard-controller
shipyard-controller-5d97dc94b5-j6tmm shipyard-controller [GIN] 2021/04/09 - 06:24:39 | 500 |  1.015598734s |       10.42.0.1 | POST     "/v1/project"
api-gateway-nginx-5c566878fb-p99q8 api-gateway-nginx 10.42.0.48 - - [09/Apr/2021:06:24:39 +0000] "POST /api/controlPlane/v1/project HTTP/1.1" 500 0 "-" "Go-http-client/1.1"
api-gateway-nginx-5c566878fb-p99q8 api-gateway-nginx 2021/04/09 06:25:39 [info] 27#27: *14713 client 10.42.0.48 closed keepalive connection
```

I've attached a sidecard to the shipyard controller to capture the traffic using tcpdump.

```
      - command:
        - /bin/sleep
        - infinity
        image: nicolaka/netshoot
        imagePullPolicy: Always
        name: netshoot
        resources: {}
        terminationMessagePath: /dev/termination-log
        terminationMessagePolicy: File
```
```
kubectl exec shipyard-controller-5f644bf4d8-rpth4 -ti -c netshoot -- /bin/bash
```

The request is failing cause the shipyard controller tries to query the kubernetes API endpoint within the `default` namespace (which is denied)

```
06:48:01.358028 IP shipyard-controller-5f644bf4d8-rpth4.47010 > kubernetes.default.svc.cluster.local.443: Flags [S], seq 3437589150, win 64860, options [mss 1410,sackOK,TS val 1682229311 ecr 0,nop,wscale 7]                                                          , length 0
06:48:01.358165 IP kubernetes.default.svc.cluster.local > shipyard-controller-5f644bf4d8-rpth4: ICMP kubernetes.default.svc.cluster.local tcp port 443 unreachable, length 68
06:48:01.359500 IP shipyard-controller-5f644bf4d8-rpth4.8080 > 10-42-0-66.api-gateway-nginx.keptn-02.svc.cluster.local.40342: Flags [P.], seq 1:114, ack 677, win 501, options [nop,nop,TS val 1095743662 ecr                                                           93697852], length 113: HTTP: HTTP/1.1 500 Internal Server Error
```

Full tcpdump output
```
 , length 0
06:48:00.330518 IP kubernetes.default.svc.cluster.local > shipyard-controller-5f644bf4d8-rpth4: ICMP kubernetes.default.svc.cluster.local tcp port 443 unreachable, length 68
06:48:00.358193 IP shipyard-controller-5f644bf4d8-rpth4.56938 > kube-dns.kube-system.svc.cluster.local.53: 54656+ PTR? 66.0.42.10.in-addr.arpa. (41)
06:48:00.358554 IP kube-dns.kube-system.svc.cluster.local.53 > shipyard-controller-5f644bf4d8-rpth4.56938: 54656*- 1/0/0 PTR 10-42-0-66.api-gateway-nginx.keptn-02.svc.cluster.local. (133)
06:48:00.361246 IP shipyard-controller-5f644bf4d8-rpth4.48311 > kube-dns.kube-system.svc.cluster.local.53: 47722+ PTR? 252.178.43.10.in-addr.arpa. (44)
06:48:00.361548 IP kube-dns.kube-system.svc.cluster.local.53 > shipyard-controller-5f644bf4d8-rpth4.48311: 47722*- 1/0/0 PTR mongodb.keptn-02.svc.cluster.local. (118)
06:48:00.361731 IP shipyard-controller-5f644bf4d8-rpth4.51652 > kube-dns.kube-system.svc.cluster.local.53: 14904+ PTR? 77.0.42.10.in-addr.arpa. (41)
06:48:00.361911 IP kube-dns.kube-system.svc.cluster.local.53 > shipyard-controller-5f644bf4d8-rpth4.51652: 14904*- 1/0/0 PTR 10-42-0-77.mongodb.keptn-02.svc.cluster.local. (123)
06:48:00.362813 IP shipyard-controller-5f644bf4d8-rpth4.39710 > kube-dns.kube-system.svc.cluster.local.53: 53975+ PTR? 1.0.43.10.in-addr.arpa. (40)
06:48:00.363020 IP kube-dns.kube-system.svc.cluster.local.53 > shipyard-controller-5f644bf4d8-rpth4.39710: 53975*- 1/0/0 PTR kubernetes.default.svc.cluster.local. (112)
06:48:00.441496 IP 10.42.0.1.43534 > shipyard-controller-5f644bf4d8-rpth4.10999: Flags [S], seq 704337290, win 64860, options [mss 1410,sackOK,TS val 1160484553 ecr 0,nop,wscale 7], length 0
06:48:00.441519 IP shipyard-controller-5f644bf4d8-rpth4.10999 > 10.42.0.1.43534: Flags [S.], seq 2733538837, ack 704337291, win 64308, options [mss 1410,sackOK,TS val 1105488117 ecr 1160484553,nop,wscale 7]                                                          , length 0
06:48:00.441543 IP 10.42.0.1.43534 > shipyard-controller-5f644bf4d8-rpth4.10999: Flags [.], ack 1, win 507, options [nop,nop,TS val 1160484553 ecr 1105488117], length 0
06:48:00.441941 IP 10.42.0.1.43534 > shipyard-controller-5f644bf4d8-rpth4.10999: Flags [P.], seq 1:111, ack 1, win 507, options [nop,nop,TS val 1160484553 ecr 1105488117], length 110
06:48:00.441963 IP shipyard-controller-5f644bf4d8-rpth4.10999 > 10.42.0.1.43534: Flags [.], ack 111, win 502, options [nop,nop,TS val 1105488117 ecr 1160484553], length 0
06:48:00.442131 IP shipyard-controller-5f644bf4d8-rpth4.10999 > 10.42.0.1.43534: Flags [P.], seq 1:143, ack 111, win 502, options [nop,nop,TS val 1105488117 ecr 1160484553], length 142
06:48:00.442160 IP shipyard-controller-5f644bf4d8-rpth4.10999 > 10.42.0.1.43534: Flags [F.], seq 143, ack 111, win 502, options [nop,nop,TS val 1105488117 ecr 1160484553], length 0
06:48:00.442200 IP 10.42.0.1.43534 > shipyard-controller-5f644bf4d8-rpth4.10999: Flags [.], ack 143, win 506, options [nop,nop,TS val 1160484553 ecr 1105488117], length 0
06:48:00.442304 IP 10.42.0.1.43534 > shipyard-controller-5f644bf4d8-rpth4.10999: Flags [F.], seq 111, ack 144, win 506, options [nop,nop,TS val 1160484553 ecr 1105488117], length 0
06:48:00.442309 IP shipyard-controller-5f644bf4d8-rpth4.10999 > 10.42.0.1.43534: Flags [.], ack 112, win 502, options [nop,nop,TS val 1105488117 ecr 1160484553], length 0
06:48:00.815250 IP shipyard-controller-5f644bf4d8-rpth4.41760 > mongodb.keptn-02.svc.cluster.local.27017: Flags [P.], seq 221:276, ack 240, win 506, options [nop,nop,TS val 19111920 ecr 3675573636], length                                                           55
06:48:00.815314 IP mongodb.keptn-02.svc.cluster.local.27017 > shipyard-controller-5f644bf4d8-rpth4.41760: Flags [.], ack 276, win 501, options [nop,nop,TS val 3675574133 ecr 19111920], length 0
06:48:00.815483 IP mongodb.keptn-02.svc.cluster.local.27017 > shipyard-controller-5f644bf4d8-rpth4.41760: Flags [P.], seq 240:464, ack 276, win 501, options [nop,nop,TS val 3675574134 ecr 19111920], length                                                           224
06:48:00.815494 IP shipyard-controller-5f644bf4d8-rpth4.41760 > mongodb.keptn-02.svc.cluster.local.27017: Flags [.], ack 464, win 505, options [nop,nop,TS val 19111921 ecr 3675574134], length 0
06:48:01.358028 IP shipyard-controller-5f644bf4d8-rpth4.47010 > kubernetes.default.svc.cluster.local.443: Flags [S], seq 3437589150, win 64860, options [mss 1410,sackOK,TS val 1682229311 ecr 0,nop,wscale 7]                                                          , length 0
06:48:01.358165 IP kubernetes.default.svc.cluster.local > shipyard-controller-5f644bf4d8-rpth4: ICMP kubernetes.default.svc.cluster.local tcp port 443 unreachable, length 68
06:48:01.359500 IP shipyard-controller-5f644bf4d8-rpth4.8080 > 10-42-0-66.api-gateway-nginx.keptn-02.svc.cluster.local.40342: Flags [P.], seq 1:114, ack 677, win 501, options [nop,nop,TS val 1095743662 ecr                                                           93697852], length 113: HTTP: HTTP/1.1 500 Internal Server Error
06:48:01.359568 IP 10-42-0-66.api-gateway-nginx.keptn-02.svc.cluster.local.40342 > shipyard-controller-5f644bf4d8-rpth4.8080: Flags [.], ack 114, win 507, options [nop,nop,TS val 93698930 ecr 1095743662], l                                                          ength 0
06:48:01.359619 IP shipyard-controller-5f644bf4d8-rpth4.8080 > 10-42-0-66.api-gateway-nginx.keptn-02.svc.cluster.local.40342: Flags [F.], seq 114, ack 677, win 501, options [nop,nop,TS val 1095743662 ecr 93                                                          698930], length 0
06:48:01.359717 IP 10-42-0-66.api-gateway-nginx.keptn-02.svc.cluster.local.40342 > shipyard-controller-5f644bf4d8-rpth4.8080: Flags [F.], seq 677, ack 115, win 507, options [nop,nop,TS val 93698930 ecr 1095                                                          743662], length 0
06:48:01.359722 IP shipyard-controller-5f644bf4d8-rpth4.8080 > 10-42-0-66.api-gateway-nginx.keptn-02.svc.cluster.local.40342: Flags [.], ack 678, win 501, options [nop,nop,TS val 1095743662 ecr 93698930], l                                                          ength 0
06:48:01.590992 IP 10.42.0.1.43556 > shipyard-controller-5f644bf4d8-rpth4.10999: Flags [S], seq 846708372, win 64860, options [mss 1410,sackOK,TS val 1160485702 ecr 0,nop,wscale 7], length 0
06:48:01.591021 IP shipyard-controller-5f644bf4d8-rpth4.10999 > 10.42.0.1.43556: Flags [S.], seq 1726270989, ack 846708373, win 64308, options [mss 1410,sackOK,TS val 1105489266 ecr 1160485702,nop,wscale 7]                                                          , length 0
06:48:01.591051 IP 10.42.0.1.43556 > shipyard-controller-5f644bf4d8-rpth4.10999: Flags [.], ack 1, win 507, options [nop,nop,TS val 1160485702 ecr 1105489266], length 0
06:48:01.591222 IP 10.42.0.1.43556 > shipyard-controller-5f644bf4d8-rpth4.10999: Flags [P.], seq 1:111, ack 1, win 507, options [nop,nop,TS val 1160485702 ecr 1105489266], length 110
06:48:01.591229 IP shipyard-controller-5f644bf4d8-rpth4.10999 > 10.42.0.1.43556: Flags [.], ack 111, win 502, options [nop,nop,TS val 1105489266 ecr 1160485702], length 0
06:48:01.591446 IP shipyard-controller-5f644bf4d8-rpth4.10999 > 10.42.0.1.43556: Flags [P.], seq 1:143, ack 111, win 502, options [nop,nop,TS val 1105489267 ecr 1160485702], length 142
06:48:01.591500 IP 10.42.0.1.43556 > shipyard-controller-5f644bf4d8-rpth4.10999: Flags [.], ack 143, win 506, options [nop,nop,TS val 1160485703 ecr 1105489267], length 0
06:48:01.591565 IP shipyard-controller-5f644bf4d8-rpth4.10999 > 10.42.0.1.43556: Flags [F.], seq 143, ack 111, win 502, options [nop,nop,TS val 1105489267 ecr 1160485703], length 0
06:48:01.591654 IP 10.42.0.1.43556 > shipyard-controller-5f644bf4d8-rpth4.10999: Flags [F.], seq 111, ack 144, win 506, options [nop,nop,TS val 1160485703 ecr 1105489267], length 0
06:48:01.591668 IP shipyard-controller-5f644bf4d8-rpth4.10999 > 10.42.0.1.43556: Flags [.], ack 112, win 502, options [nop,nop,TS val 1105489267 ecr 1160485703], length 0
06:48:02.331988 IP keptn-nats-cluster-0.keptn-nats-cluster.keptn-02.svc.cluster.local.4222 > shipyard-controller-5f644bf4d8-rpth4.45276: Flags [P.], seq 284:290, ack 529, win 501, options [nop,nop,TS val 40                                                          01764904 ecr 166339336], length 6
06:48:02.332021 IP shipyard-controller-5f644bf4d8-rpth4.45276 > keptn-nats-cluster-0.keptn-nats-cluster.keptn-02.svc.cluster.local.4222: Flags [.], ack 290, win 505, options [nop,nop,TS val 166341357 ecr 40                                                          01764904], length 0
06:48:02.332113 IP shipyard-controller-5f644bf4d8-rpth4.45276 > keptn-nats-cluster-0.keptn-nats-cluster.keptn-02.svc.cluster.local.4222: Flags [P.], seq 529:535, ack 290, win 505, options [nop,nop,TS val 16                                                          6341357 ecr 4001764904], length 6
06:48:02.332145 IP keptn-nats-cluster-0.keptn-nats-cluster.keptn-02.svc.cluster.local.4222 > shipyard-controller-5f644bf4d8-rpth4.45276: Flags [.], ack 535, win 501, options [nop,nop,TS val 4001764904 ecr 1                                                          66341357], length 0
06:48:05.441553 IP 10.42.0.1.43630 > shipyard-controller-5f644bf4d8-rpth4.10999: Flags [S], seq 1918745472, win 64860, options [mss 1410,sackOK,TS val 1160489553 ecr 0,nop,wscale 7], length 0
06:48:05.441577 IP shipyard-controller-5f644bf4d8-rpth4.10999 > 10.42.0.1.43630: Flags [S.], seq 3703761870, ack 1918745473, win 64308, options [mss 1410,sackOK,TS val 1105493117 ecr 1160489553,nop,wscale 7                                                          ], length 0
06:48:05.441601 IP 10.42.0.1.43630 > shipyard-controller-5f644bf4d8-rpth4.10999: Flags [.], ack 1, win 507, options [nop,nop,TS val 1160489553 ecr 1105493117], length 0
06:48:05.441781 IP 10.42.0.1.43630 > shipyard-controller-5f644bf4d8-rpth4.10999: Flags [P.], seq 1:111, ack 1, win 507, options [nop,nop,TS val 1160489553 ecr 1105493117], length 110
06:48:05.441788 IP shipyard-controller-5f644bf4d8-rpth4.10999 > 10.42.0.1.43630: Flags [.], ack 111, win 502, options [nop,nop,TS val 1105493117 ecr 1160489553], length 0
06:48:05.442081 IP shipyard-controller-5f644bf4d8-rpth4.10999 > 10.42.0.1.43630: Flags [P.], seq 1:143, ack 111, win 502, options [nop,nop,TS val 1105493117 ecr 1160489553], length 142
06:48:05.442104 IP 10.42.0.1.43630 > shipyard-controller-5f644bf4d8-rpth4.10999: Flags [.], ack 143, win 506, options [nop,nop,TS val 1160489553 ecr 1105493117], length 0
06:48:05.442130 IP shipyard-controller-5f644bf4d8-rpth4.10999 > 10.42.0.1.43630: Flags [F.], seq 143, ack 111, win 502, options [nop,nop,TS val 1105493117 ecr 1160489553], length 0
06:48:05.442227 IP 10.42.0.1.43630 > shipyard-controller-5f644bf4d8-rpth4.10999: Flags [F.], seq 111, ack 144, win 506, options [nop,nop,TS val 1160489553 ecr 1105493117], length 0
06:48:05.442239 IP shipyard-controller-5f644bf4d8-rpth4.10999 > 10.42.0.1.43630: Flags [.], ack 112, win 502, options [nop,nop,TS val 1105493117 ecr 1160489553], length 0
```

All other commands like create service/get service/delete project/get projects are working.

Have a good one!
