### ISSUE TITLE
Airgapped System - Document which Docker Images are required for setting up Keptn and what external connections are required

### ISSUE THREAD

**Issue by christian-kreuzberger-dtx** [keptn/keptn#1979]
We have documented a couple of Docker Images that are required for running Keptn in our manifest installation: https://keptn.sh/docs/develop/operate/manifest_installation/

Unfortunately this seems to be not enough, for instance:
* nats-operator pulls a nats docker image
* nats-operator seems to connect to some other services

Source: https://keptn.slack.com/archives/CNRCGFU3U/p1593405880035700

It would be ideal that we setup a test system that is airgapped, and verify what is needed (and maybe make some changes to the code, if possible/necessary).

**Comment by YeongchanSeo** [comment]
I have tried tcpdump while I am installing with manifest, and could know the list of domains below is needed communication through internet.
```
17:01:31.781676 IP 100.69.204.130.43478 > 100.65.2.78.webcache: Flags [P.], seq 1:90, ack 1, win 229, options [nop,nop,TS val 2101446 ecr 4256782099], length 89: HTTP: CONNECT k8s.gcr.io:443 HTTP/1.1
17:36:40.458094 IP 100.69.192.140.35114 > 100.65.2.78.webcache: Flags [P.], seq 1:114, ack 1, win 229, options [nop,nop,TS val 283708 ecr 4257309274], length 113: HTTP: CONNECT storage.googleapis.com:443 HTTP/1.1
17:36:44.816109 IP 100.69.192.140.35118 > 100.65.2.78.webcache: Flags [P.], seq 1:84, ack 1, win 229, options [nop,nop,TS val 288066 ecr 4257310364], length 83: HTTP: CONNECT quay.io:443 HTTP/1.1
17:36:46.526122 IP 100.69.192.140.35120 > 100.65.2.78.webcache: Flags [P.], seq 1:96, ack 1, win 229, options [nop,nop,TS val 289776 ecr 4257310791], length 95: HTTP: CONNECT cdn02.quay.io:443 HTTP/1.1
17:37:05.428818 IP 100.69.192.140.35154 > 100.65.2.78.webcache: Flags [P.], seq 1:110, ack 1, win 229, options [nop,nop,TS val 308678 ecr 4257315517], length 109: HTTP: CONNECT registry-1.docker.io:443 HTTP/1.1
17:37:06.181937 IP 100.69.192.140.35160 > 100.65.2.78.webcache: Flags [P.], seq 1:98, ack 1, win 229, options [nop,nop,TS val 309432 ecr 4257315705], length 97: HTTP: CONNECT auth.docker.io:443 HTTP/1.1
17:37:07.999566 IP 100.69.192.140.35166 > 100.65.2.78.webcache: Flags [P.], seq 1:134, ack 1, win 229, options [nop,nop,TS val 311249 ecr 4257316160], length 133: HTTP: CONNECT production.cloudflare.docker.com:443 HTTP/1.1
```

**Comment by agrimmer** [comment]
With my PR #2022, the Keptn installer is now distributed as Helm-chart. Especially, also NATS is now installed using a Helm chart instead of an operator. Therefore, we can precisely specify which images are needed.

**Comment by agrimmer** [comment]
Since version 0.7.0, we distribute Keptn as a Helm chart which allows setting the registry for the required Docker images. Therefore, please use the [Helm CLI](https://helm.sh/) for installing Keptn. More precisely, you can use the following commands in order to install Keptn and manually set all images from the control-plane as well as execution-plane:
1. `helm repo add keptn https://storage.googleapis.com/keptn-installer`
2. `helm repo update`
3. 
```
helm install keptn keptn/keptn -n keptn --create-namespace  --set=control-plane.apiGatewayNginx.type=LoadBalancer,\
continuous-delivery.enabled=true,\
control-plane.mongodb.image.repository=eu.gcr.io/sai-research/centos/mongodb-36-centos7,\
control-plane.nats.nats.image=eu.gcr.io/sai-research/nats:2.1.7-alpine3.11,\
control-plane.nats.reloader.image=eu.gcr.io/sai-research/connecteverything/nats-server-config-reloader:0.6.0,\
control-plane.nats.exporter.image=eu.gcr.io/sai-research/synadia/prometheus-nats-exporter:0.5.0,\
control-plane.apiGatewayNginx.image.repository=eu.gcr.io/sai-research/nginxinc/nginx-unprivileged,\
control-plane.remediationService.image.repository=eu.gcr.io/sai-research/keptn/remediation-service,\
control-plane.apiService.image.repository=eu.gcr.io/sai-research/keptn/api,\
control-plane.bridge.image.repository=eu.gcr.io/sai-research/keptn/bridge2,\
control-plane.eventbroker.image.repository=eu.gcr.io/sai-research/keptn/eventbroker-go,\
control-plane.helmService.image.repository=eu.gcr.io/sai-research/keptn/helm-service,\
control-plane.distributor.image.repository=eu.gcr.io/sai-research/keptn/distributor,\
control-plane.shipyardService.image.repository=eu.gcr.io/sai-research/keptn/shipyard-service,\
control-plane.configurationService.image.repository=eu.gcr.io/sai-research/keptn/configuration-service,\
control-plane.mongodbDatastore.image.repository=eu.gcr.io/sai-research/keptn/mongodb-datastore,\
control-plane.lighthouseService.image.repository=eu.gcr.io/sai-research/keptn/lighthouse-service,\
continuous-delivery.gatekeeperService.image.repository=eu.gcr.io/sai-research/keptn/gatekeeper-service,\
continuous-delivery.distributor.image.repository=eu.gcr.io/sai-research/keptn/distributor,\
continuous-delivery.jmeterService.image.repository=eu.gcr.io/sai-research/keptn/jmeter-service\
/
```

For pulling, re-tagging, and pushing all Keptn Docker images, I wrote the following helper script:
```
#!/bin/bash
KEPTN_TAG=0.7.0
IMAGES_CONTROL_PLANE="centos/mongodb-36-centos7:1 nats:2.1.7-alpine3.11 connecteverything/nats-server-config-reloader:0.6.0 synadia/prometheus-nats-exporter:0.5.0 nginxinc/nginx-unprivileged:1.19.1-alpine keptn/remediation-service:${KEPTN_TAG} keptn/api:${KEPTN_TAG} keptn/bridge2:${KEPTN_TAG} keptn/eventbroker-go:${KEPTN_TAG} keptn/helm-service:${KEPTN_TAG} keptn/distributor:${KEPTN_TAG} keptn/shipyard-service:${KEPTN_TAG} keptn/configuration-service:${KEPTN_TAG} keptn/mongodb-datastore:${KEPTN_TAG} keptn/lighthouse-service:${KEPTN_TAG}"
# IMAGES_CONTINUOUS_DELIVERY="keptn/gatekeeper-service:${KEPTN_TAG} keptn/jmeter-service:${KEPTN_TAG}"
INTERNAL_DOCKER_REGISTRY="YOUR_REGISTRY/"

for img in $IMAGES_CONTROL_PLANE
do
    echo $img
    docker pull $img
    docker tag $img ${INTERNAL_DOCKER_REGISTRY}${img}
    docker push ${INTERNAL_DOCKER_REGISTRY}${img}
    echo ${INTERNAL_DOCKER_REGISTRY}${img}
done
```

**Comment by agrimmer** [comment]
We also put these descriptions on keptn.sh

**Comment by agrimmer** [comment]
Documentation was added with https://github.com/keptn/keptn.github.io/pull/597
